{
  "$schema": "../../../schemas/preflight-result.schema.json",
  "schema_version": "1.0",
  "task_id": "phase3-ambiguous-blocking",
  "resolution_id": "phase3-ambiguous-blocking-resolution",
  "checked_at": "2026-07-30T09:34:00Z",
  "status": "BLOCKED",
  "can_execute": false,
  "checks": [
    {"check_id": "action", "status": "failed", "subject": "action", "message": "Develop, Review, and Analyze are ambiguous.", "path": null},
    {"check_id": "role", "status": "failed", "subject": "role_id", "message": "No role can be mapped from an unknown action.", "path": null},
    {"check_id": "target", "status": "failed", "subject": "targets", "message": "Target candidates are not safe for routing.", "path": null}
  ],
  "blockers": ["Action is unresolved.", "Role is unresolved.", "Target is unresolved.", "Lunch Module Context is unbound."],
  "warnings": [],
  "execution_contract": null
}
